{
  "$schema": "./narcoscope-palimpsest-bri-v1.schema.json",
  "schemaVersion": "narcoscope.palimpsest.bri-context.v1",
  "artifactId": "narcoscope.palimpsest.bri-parallel-context",
  "dataAsOf": "2026-08-26T15:55:34Z",
  "scope": "Bounded Palimpsest Belt and Road readiness and national economic context for China, Pakistan and Myanmar, published beside but never merged into NarcoScope drug-market inference.",
  "provenance": {
    "producer": "Palimpsest",
    "consumer": "NarcoScope",
    "sourcePin": {
      "path": "scripts/bridge/palimpsest-bri-source-pin.json",
      "schemaVersion": "narcoscope.palimpsest.bri-source-pin.v1",
      "sha256": "5f4098990ca23534f68d890619cc62db608e763fa62b148354da1e69196990a0"
    },
    "release": {
      "producer": "Palimpsest",
      "status": "production_verified_at_release",
      "canonicalBaseUrl": "https://palimpsest.info",
      "railwayMirrorBaseUrl": "https://palimpsest-publication-production.up.railway.app",
      "deploymentId": "a932af4d-5b31-4a50-880b-ebb8a0d4b14a",
      "sourceRevision": "ebfcc0ca79c83bad1f5e51f5269bc7bdf67add8d",
      "artifactTreeSha256": "bfefe7d6278ab68501589230824dbf6fac3003e12c2ffd9b0478b353bb1568ef",
      "receiptSha256": "bcde69d3736aef4841ce42379caf86e431c08908a3d1da4fa6df963b942df60f",
      "verifiedAt": "2026-08-26T17:58:17Z",
      "verificationSemantics": "Point-in-time exact-release verification; not continuous availability or freshness monitoring.",
      "pagesPublication": {
        "status": "production_verified",
        "sourceRevision": "14b06772dfed6cdc736279c9ab61b444e5846598",
        "receiptSha256": "239a6b5e1496eaf3f97d8d0502cbf1581f24b02ba386d7d806adc79a877d2a06",
        "verifiedAt": "2026-08-26T15:55:34Z",
        "freshUntil": "2026-08-27T15:55:34Z",
        "availabilitySemantics": "verified_at_release_not_continuous_monitoring"
      }
    },
    "sourceArtifacts": {
      "observatory": {
        "path": "readings/belt-and-road-observatory-latest.json",
        "canonicalUrl": "https://palimpsest.info/readings/belt-and-road-observatory-latest.json",
        "railwayMirrorUrl": "https://palimpsest-publication-production.up.railway.app/readings/belt-and-road-observatory-latest.json",
        "bytes": 92972,
        "sha256": "1f6d1d9781a031ecc07ec2219133116e463b6df25f35a6d52bf220b2f874d11f"
      },
      "economics": {
        "path": "readings/bri-economic-observations-latest.json",
        "canonicalUrl": "https://palimpsest.info/readings/bri-economic-observations-latest.json",
        "railwayMirrorUrl": "https://palimpsest-publication-production.up.railway.app/readings/bri-economic-observations-latest.json",
        "bytes": 6915160,
        "sha256": "68b9f96e3cfc1e5692b4305c93b42b64dd45d065655ccade6947e086285dc099"
      },
      "pagesPublicationReceipt": {
        "path": ".well-known/receipts/bri-wdi-pages-publication-v1.json",
        "canonicalUrl": "https://palimpsest.info/.well-known/receipts/bri-wdi-pages-publication-v1.json",
        "bytes": 4846,
        "sha256": "239a6b5e1496eaf3f97d8d0502cbf1581f24b02ba386d7d806adc79a877d2a06"
      }
    }
  },
  "sourceReadiness": {
    "sourceCount": 42,
    "buildReadySourceCount": 10,
    "implementationStates": {
      "adapter_ready": 8,
      "blocked": 1,
      "link_only": 23,
      "live": 2,
      "planned": 8
    },
    "rightsStatusCounts": {
      "attribution": 7,
      "licensed_no_redistribution": 1,
      "link_only_pending_review": 12,
      "official_publication_review_required": 19,
      "open_reuse": 1,
      "public_domain": 2
    },
    "buildReadyGaps": [
      "compensation",
      "contract",
      "contractor",
      "elections",
      "human_rights",
      "land",
      "ownership",
      "procurement"
    ]
  },
  "claimSemantics": {
    "classificationRule": "Source class, authority role and claim class are separate, non-exclusive fields. Official publication is not independent corroboration, and a modeled or analytical estimate is not an observed project fact.",
    "sourceClassCounts": {
      "civil_society": 1,
      "legal": 4,
      "multilateral": 12,
      "official_china": 4,
      "official_host": 13,
      "partner": 1,
      "research": 7
    },
    "authorityRoleCounts": {
      "administrative_position": 5,
      "analytical_estimate": 7,
      "independent_observation": 13,
      "legal_instrument": 2,
      "partner_aggregate": 1,
      "primary_record": 14
    },
    "claimClassCounts": {
      "administrative_action": 4,
      "allegation": 3,
      "analytical_estimate": 9,
      "humanitarian_observation": 2,
      "legal_status": 2,
      "licensed_event": 1,
      "modeled_estimate": 5,
      "official_position": 5,
      "official_statistic": 18,
      "partner_aggregate": 1,
      "project_register": 7,
      "reported_event": 9
    },
    "officialOrAdministrativeSourceIds": [
      "balochistan_budget",
      "balochistan_pnd",
      "balochistan_statistics",
      "china_bri_portal",
      "cpec_project_portal",
      "ecp_results",
      "gacc_bilateral_trade",
      "gwadar_port_authority",
      "mofcom_bri_engagement",
      "mofcom_outward_fdi_bulletin",
      "myanmar_dica",
      "myanmar_moi_cmec",
      "myanmar_port_authority",
      "nacta_proscribed",
      "ofac_actions",
      "pakistan_finance_debt",
      "pakistan_planning_psdp",
      "pbs_trade_labor",
      "sbp_external_sector",
      "uk_proscription",
      "us_federal_register_bla"
    ],
    "independentObservationSourceIds": [
      "acled_events",
      "aiddata_gcdf",
      "bu_codf",
      "copernicus_sentinel2",
      "global_energy_monitor",
      "hrcp_reports",
      "iimm_reports",
      "ocha_myanmar",
      "ohchr_balochistan",
      "ucdp_events",
      "un_comtrade",
      "world_bank_ids",
      "world_bank_wdi"
    ],
    "modeledOrAnalyticalSourceIds": [
      "aei_cgit",
      "aiddata_gcdf",
      "bu_codf",
      "copernicus_sentinel2",
      "global_energy_monitor",
      "greenfdc_bri",
      "imf_portwatch",
      "imf_weo",
      "ucdp_events",
      "unodc_myanmar_opium",
      "world_bank_bri_network",
      "world_bank_myanmar_monitor",
      "world_bank_wdi"
    ]
  },
  "targetCoverage": [
    {
      "areaId": "cpec",
      "label": "China-Pakistan Economic Corridor",
      "targets": [
        {
          "targetId": "cpec_portfolio",
          "label": "China-Pakistan Economic Corridor portfolio",
          "targetType": "economic_corridor",
          "evidenceStatus": "source_discovery",
          "requiredCoverage": [
            "contract",
            "debt",
            "finance_commitment",
            "project_identity",
            "project_status",
            "trade"
          ],
          "sourceReadiness": {
            "sourceCount": 4,
            "buildReadySourceCount": 0,
            "implementationStates": {
              "link_only": 1,
              "planned": 3
            }
          },
          "sources": [
            {
              "sourceId": "cpec_project_portal",
              "implementationState": "link_only",
              "sourceClass": "official_host",
              "authorityRole": "administrative_position",
              "rightsStatus": "official_publication_review_required",
              "claimClasses": [
                "official_position",
                "project_register"
              ]
            },
            {
              "sourceId": "pakistan_finance_debt",
              "implementationState": "planned",
              "sourceClass": "official_host",
              "authorityRole": "primary_record",
              "rightsStatus": "official_publication_review_required",
              "claimClasses": [
                "official_statistic"
              ]
            },
            {
              "sourceId": "pakistan_planning_psdp",
              "implementationState": "planned",
              "sourceClass": "official_host",
              "authorityRole": "primary_record",
              "rightsStatus": "official_publication_review_required",
              "claimClasses": [
                "official_statistic",
                "project_register"
              ]
            },
            {
              "sourceId": "sbp_external_sector",
              "implementationState": "planned",
              "sourceClass": "official_host",
              "authorityRole": "primary_record",
              "rightsStatus": "official_publication_review_required",
              "claimClasses": [
                "official_statistic"
              ]
            }
          ]
        }
      ]
    },
    {
      "areaId": "gwadar",
      "label": "Gwadar infrastructure and local political economy",
      "targets": [
        {
          "targetId": "gwadar_port_free_zone",
          "label": "Gwadar Port and Free Zone",
          "targetType": "port_and_sez",
          "evidenceStatus": "source_discovery",
          "requiredCoverage": [
            "contractor",
            "employment",
            "environment",
            "land",
            "livelihood",
            "ownership",
            "port_logistics",
            "project_status"
          ],
          "sourceReadiness": {
            "sourceCount": 4,
            "buildReadySourceCount": 1,
            "implementationStates": {
              "adapter_ready": 1,
              "link_only": 3
            }
          },
          "sources": [
            {
              "sourceId": "balochistan_pnd",
              "implementationState": "link_only",
              "sourceClass": "official_host",
              "authorityRole": "primary_record",
              "rightsStatus": "official_publication_review_required",
              "claimClasses": [
                "official_statistic",
                "project_register"
              ]
            },
            {
              "sourceId": "copernicus_sentinel2",
              "implementationState": "adapter_ready",